{
  "access": {
    "kubernetes": {
      "context": "context:611e49b22818",
      "identity": "identity:547a4b6a7894",
      "server": "server:6076e1dcf760"
    }
  },
  "captured_at": "2026-10-18T03:59:31.784001+00:00",
  "cleanup": {
    "failures": [],
    "resources": [
      {
        "absent": true,
        "kind": "Job",
        "name": "ci-skills-run-podman-probe-d807d35b31c50a24",
        "namespace": "ci-skills-run-4114bc31589d4a30973b",
        "status": "PASS"
      },
      {
        "absent": true,
        "kind": "ConfigMap",
        "name": "ci-skills-run-podman-scripts-d807d35b31c50a24",
        "namespace": "ci-skills-run-4114bc31589d4a30973b",
        "status": "PASS"
      },
      {
        "absent": true,
        "kind": "RoleBinding",
        "name": "ci-skills-run-scc-permission-5f4add9322d9458c-d807d35b31c50a24",
        "namespace": "ci-skills-run-4114bc31589d4a30973b",
        "status": "PASS"
      },
      {
        "absent": true,
        "kind": "Namespace",
        "name": "ci-skills-run-4114bc31589d4a30973b",
        "namespace": "",
        "status": "PASS"
      }
    ],
    "status": "PASS"
  },
  "confirmable": true,
  "errors": [],
  "filters": {},
  "kind": "image_build_readiness",
  "namespace": "ci-skills-run-4114bc31589d4a30973b",
  "operation": "probe",
  "plan": {
    "authorization": {
      "behavior": "reuse_existing_or_create_temporary_role_binding",
      "cluster_role": "system:openshift:scc:privileged",
      "constraint": "privileged",
      "provider": "openshift_scc_access",
      "service_account": "default"
    },
    "claim": "nested_podman_runtime_readiness",
    "inner_image": "docker.io/library/busybox@sha256:bdf57e528e45e4433820e045b29b4597825a1c9e38353532d90a01445013f82e",
    "kind": "image_build_readiness",
    "operation": "probe",
    "probe_image": "quay.io/podman/stable@sha256:5118bdbb154b115d77f58107a2e69d65df4375bcb0d89a8da10b055754e8b9f3",
    "resources": {
      "cpu_limit": "1",
      "cpu_request": "250m",
      "memory_limit": "1Gi",
      "memory_request": "256Mi",
      "storage_size": "8Gi"
    },
    "run_scope": {
      "namespace": null,
      "namespace_mode": "generated",
      "service_account": "default"
    },
    "script_digest": "56910939591e750f910e8a8313a569125e72e9dca439b35bd76af03913f71110",
    "selected_node": "selected_node:6a2c50906795",
    "side_effects_on_apply": [
      "temporary_namespace",
      "temporary_scc_role_binding_when_required",
      "temporary_configmap",
      "temporary_job"
    ],
    "target": {
      "context": "context:611e49b22818",
      "server": "server:6076e1dcf760"
    },
    "timeout_seconds": 300
  },
  "plan_digest": "1df59ce9212a91d8a8a85a3e6f3fff5db4430bde4c35d3826703642acad3cd30",
  "probe_artifacts": {
    "log": "image_build_readiness-694346b9bc6b4547aeae61c02a1d368c.probe.log",
    "markers": "image_build_readiness-694346b9bc6b4547aeae61c02a1d368c.markers.json"
  },
  "records": [
    {
      "action": "VERIFIED",
      "callback": "SelectReadyWorker",
      "node": {
        "kernelVersion": "5.14.0-570.98.1.el9_6.x86_64",
        "name": "node:6a2c50906795",
        "osImage": "Red Hat Enterprise Linux CoreOS 9.6.20260309-0 (Plow)"
      },
      "selected_node": "selected_node:6a2c50906795",
      "selection": "requested",
      "verified": true
    },
    {
      "action": "VERIFIED",
      "callback": "ConfirmPodmanProbe",
      "plan_digest": "1df59ce9212a91d8a8a85a3e6f3fff5db4430bde4c35d3826703642acad3cd30",
      "selected_node": "selected_node:6a2c50906795",
      "verified": true
    },
    {
      "action": "APPLIED",
      "callback": "OpenProbeNamespace",
      "namespace": "ci-skills-run-4114bc31589d4a30973b",
      "owns_namespace": true,
      "reused": false,
      "run_id": "694346b9bc6b4547aeae61c02a1d368c",
      "verified": true
    },
    {
      "action": "APPLIED",
      "callback": "EnsureSCCAccess",
      "cluster_role": "system:openshift:scc:privileged",
      "constraint": "privileged",
      "outcome": "scc_access_ready",
      "permission_source": "temporary_role_binding",
      "role_binding": {
        "action": "APPLIED",
        "kind": "RoleBinding",
        "name": "ci-skills-run-scc-permission-5f4add9322d9458c-d807d35b31c50a24",
        "namespace": "ci-skills-run-4114bc31589d4a30973b",
        "uid": "48e1c2c4-b842-4e36-8b1f-d877ae986da9"
      },
      "service_account": "system:serviceaccount:ci-skills-run-4114bc31589d4a30973b:default",
      "verified": true
    },
    {
      "action": "APPLIED",
      "callback": "RunPodmanProbe",
      "claim": "nested_podman_runtime_readiness",
      "job": {
        "name": "ci-skills-run-podman-probe-d807d35b31c50a24",
        "uid": "bcf1d0ab-8ee7-46f0-afbe-448316884425"
      },
      "namespace": "ci-skills-run-4114bc31589d4a30973b",
      "nested_runtime_ready": true,
      "node": {
        "kernelVersion": "5.14.0-570.98.1.el9_6.x86_64",
        "name": "node:6a2c50906795",
        "osImage": "Red Hat Enterprise Linux CoreOS 9.6.20260309-0 (Plow)"
      },
      "outcome": "ready",
      "owns_namespace": true,
      "pod": {
        "exit_code": 0,
        "image_id": "quay.io/podman/stable@sha256:5118bdbb154b115d77f58107a2e69d65df4375bcb0d89a8da10b055754e8b9f3",
        "name": "ci-skills-run-podman-probe-d807d35b31c50a24-cgt4b",
        "uid": "2aad16a5-0e39-4a65-b01e-f9c175cc69e4"
      },
      "rows": [
        {
          "check": "kernel",
          "observed": "Linux 5.14.0-570.98.1.el9_6.x86_64",
          "status": "PASS"
        },
        {
          "check": "podman_version",
          "observed": "podman version 5.8.7",
          "status": "PASS"
        },
        {
          "check": "storage",
          "observed": "driver=overlay;mount_program=none;cgroup_manager=cgroupfs;graph_root=/var/lib/containers/storage;cgroup_version=v2",
          "status": "PASS"
        },
        {
          "check": "backing_filesystem",
          "observed": "xfs",
          "status": "PASS"
        },
        {
          "check": "inner_runtime",
          "observed": "id=55410a0f6b30e13a28f59d2b03165c18dc5fdb5004b9f43abf77b9ecaa7b7d99;marker=inner-ok;cgroup=0::/kubepods.slice/kubepods-burstable.slice/kubepods-burstable-pod2aad16a5_0e39_4a65_b01e_f9c175cc69e4.slice/crio-a1f38af149a4bf6b9b06884975112e66b9cff724265c065a5320ce1717a99ee8.scope,;root=22687 22665 0:1433 / / rw,relatime - overlay overlay rw,seclabel,lowerdir=/var/lib/containers/storage/overlay/l/SETI427VIPOTCYMGQGTYS2W5VY,upperdir=/var/lib/containers/storage/overlay/edb4b88b72e9170f1cc02e86ded24692e3b788f77619c97826feb1c88db1fdcf/diff,workdir=/var/lib/containers/storage/overlay/edb4b88b72e9170f1cc02e86ded24692e3b788f77619c97826feb1c88db1fdcf/work",
          "status": "PASS"
        },
        {
          "check": "bind_readback",
          "observed": "ready",
          "status": "PASS"
        },
        {
          "check": "expected_exit",
          "observed": "7",
          "status": "PASS"
        },
        {
          "check": "remaining_containers",
          "observed": "none",
          "status": "PASS"
        }
      ],
      "selected_node": "selected_node:6a2c50906795",
      "service_account": "system:serviceaccount:ci-skills-run-4114bc31589d4a30973b:default",
      "verified": true
    }
  ],
  "run_id": "694346b9bc6b4547aeae61c02a1d368c",
  "schema_version": "1.0",
  "selected_node": "selected_node:6a2c50906795",
  "skill": {
    "algorithm": "sha256-tree-v1",
    "consuming_project": {
      "commit": null,
      "source": null
    },
    "digest": "ab0640b86de635a743383bf7543fb67c99b0ad98461d8a5be78e43d9b7f69564",
    "file_count": 176,
    "functional_digest": "49525a9ed253dd627ee4c75b2a46fa9dab9494883e6fa4f789ee8fe3e4f547d3",
    "revision": {
      "source": "installer_record",
      "value": "855f00b4d2fad7c54764b33df256236e1f9b412d",
      "verified": true
    }
  },
  "status": "PASS",
  "summary": {
    "error_count": 0,
    "record_count": 5
  },
  "target": "target:7bd724cadedd",
  "target_file": "path:5e5380df1eda",
  "target_source": "user",
  "tested_revision": "855f00b4d2fad7c54764b33df256236e1f9b412d"
}
