{
  "access": {
    "kubernetes": {
      "context": "context:611e49b22818",
      "identity": "identity:547a4b6a7894",
      "server": "server:6076e1dcf760"
    }
  },
  "captured_at": "2026-10-18T16:18:12.804607+00:00",
  "cleanup": {
    "failures": [],
    "resources": [
      {
        "absent": true,
        "kind": "Job",
        "name": "ci-skills-run-podman-probe-c5530b16a4b9db36",
        "namespace": "ci-skills-run-948f7c274cbe4a25bea9",
        "status": "PASS"
      },
      {
        "absent": true,
        "kind": "ConfigMap",
        "name": "ci-skills-run-podman-scripts-c5530b16a4b9db36",
        "namespace": "ci-skills-run-948f7c274cbe4a25bea9",
        "status": "PASS"
      },
      {
        "absent": true,
        "kind": "RoleBinding",
        "name": "ci-skills-run-scc-permission-5f4add9322d9458c-c5530b16a4b9db36",
        "namespace": "ci-skills-run-948f7c274cbe4a25bea9",
        "status": "PASS"
      },
      {
        "absent": true,
        "kind": "Namespace",
        "name": "ci-skills-run-948f7c274cbe4a25bea9",
        "namespace": "",
        "status": "PASS"
      }
    ],
    "status": "PASS"
  },
  "confirmable": true,
  "errors": [],
  "filters": {},
  "kind": "image_build_readiness",
  "namespace": "ci-skills-run-948f7c274cbe4a25bea9",
  "operation": "probe",
  "plan": {
    "authorization": {
      "behavior": "reuse_existing_or_create_temporary_role_binding",
      "cluster_role": "system:openshift:scc:privileged",
      "constraint": "privileged",
      "provider": "openshift_scc_access",
      "service_account": "default"
    },
    "claim": "nested_podman_runtime_readiness",
    "inner_image": "docker.io/library/busybox@sha256:bdf57e528e45e4433820e045b29b4597825a1c9e38353532d90a01445013f82e",
    "kind": "image_build_readiness",
    "operation": "probe",
    "probe_image": "quay.io/podman/stable@sha256:5118bdbb154b115d77f58107a2e69d65df4375bcb0d89a8da10b055754e8b9f3",
    "resources": {
      "cpu_limit": "1",
      "cpu_request": "250m",
      "memory_limit": "1Gi",
      "memory_request": "256Mi",
      "storage_size": "8Gi"
    },
    "run_scope": {
      "namespace": null,
      "namespace_mode": "generated",
      "service_account": "default"
    },
    "script_digest": "56910939591e750f910e8a8313a569125e72e9dca439b35bd76af03913f71110",
    "selected_node": "selected_node:6a2c50906795",
    "side_effects_on_apply": [
      "temporary_namespace",
      "temporary_scc_role_binding_when_required",
      "temporary_configmap",
      "temporary_job"
    ],
    "target": {
      "context": "context:611e49b22818",
      "server": "server:6076e1dcf760"
    },
    "timeout_seconds": 300
  },
  "plan_digest": "1df59ce9212a91d8a8a85a3e6f3fff5db4430bde4c35d3826703642acad3cd30",
  "probe_artifacts": {
    "log": "image_build_readiness-a418c7dbb24141e09a7f26d920b96af5.probe.log",
    "markers": "image_build_readiness-a418c7dbb24141e09a7f26d920b96af5.markers.json"
  },
  "records": [
    {
      "action": "VERIFIED",
      "callback": "SelectReadyWorker",
      "node": {
        "kernelVersion": "5.14.0-570.98.1.el9_6.x86_64",
        "name": "node:6a2c50906795",
        "osImage": "Red Hat Enterprise Linux CoreOS 9.6.20260309-0 (Plow)"
      },
      "selected_node": "selected_node:6a2c50906795",
      "selection": "requested",
      "verified": true
    },
    {
      "action": "VERIFIED",
      "callback": "ConfirmPodmanProbe",
      "plan_digest": "1df59ce9212a91d8a8a85a3e6f3fff5db4430bde4c35d3826703642acad3cd30",
      "selected_node": "selected_node:6a2c50906795",
      "verified": true
    },
    {
      "action": "APPLIED",
      "callback": "OpenProbeNamespace",
      "namespace": "ci-skills-run-948f7c274cbe4a25bea9",
      "owns_namespace": true,
      "reused": false,
      "run_id": "a418c7dbb24141e09a7f26d920b96af5",
      "verified": true
    },
    {
      "action": "APPLIED",
      "callback": "EnsureSCCAccess",
      "cluster_role": "system:openshift:scc:privileged",
      "constraint": "privileged",
      "outcome": "scc_access_ready",
      "permission_source": "temporary_role_binding",
      "role_binding": {
        "action": "APPLIED",
        "kind": "RoleBinding",
        "name": "ci-skills-run-scc-permission-5f4add9322d9458c-c5530b16a4b9db36",
        "namespace": "ci-skills-run-948f7c274cbe4a25bea9",
        "uid": "5c560527-9864-4072-9cde-2c3320249e99"
      },
      "service_account": "system:serviceaccount:ci-skills-run-948f7c274cbe4a25bea9:default",
      "verified": true
    },
    {
      "action": "APPLIED",
      "callback": "RunPodmanProbe",
      "claim": "nested_podman_runtime_readiness",
      "job": {
        "name": "ci-skills-run-podman-probe-c5530b16a4b9db36",
        "uid": "97957279-60d3-44fa-8abf-9a343744db2a"
      },
      "namespace": "ci-skills-run-948f7c274cbe4a25bea9",
      "nested_runtime_ready": true,
      "node": {
        "kernelVersion": "5.14.0-570.98.1.el9_6.x86_64",
        "name": "node:6a2c50906795",
        "osImage": "Red Hat Enterprise Linux CoreOS 9.6.20260309-0 (Plow)"
      },
      "outcome": "ready",
      "owns_namespace": true,
      "pod": {
        "exit_code": 0,
        "image_id": "quay.io/podman/stable@sha256:5118bdbb154b115d77f58107a2e69d65df4375bcb0d89a8da10b055754e8b9f3",
        "name": "ci-skills-run-podman-probe-c5530b16a4b9db36-t45lk",
        "uid": "75367afb-31d6-446a-b07e-acb10120ebd3"
      },
      "rows": [
        {
          "check": "kernel",
          "observed": "Linux 5.14.0-570.98.1.el9_6.x86_64",
          "status": "PASS"
        },
        {
          "check": "podman_version",
          "observed": "podman version 5.8.7",
          "status": "PASS"
        },
        {
          "check": "storage",
          "observed": "driver=overlay;mount_program=none;cgroup_manager=cgroupfs;graph_root=/var/lib/containers/storage;cgroup_version=v2",
          "status": "PASS"
        },
        {
          "check": "backing_filesystem",
          "observed": "xfs",
          "status": "PASS"
        },
        {
          "check": "inner_runtime",
          "observed": "id=0ddc0bae9d31ea7998be5a6e1c104b7d2d2754bffbe05c014935de7a110f5f75;marker=inner-ok;cgroup=0::/kubepods.slice/kubepods-burstable.slice/kubepods-burstable-pod75367afb_31d6_446a_b07e_acb10120ebd3.slice/crio-2b2fa9a76a39375b23426c94eeb5a5edf6aec72e1b7b63103b3d9de2f113ab30.scope,;root=21355 16607 0:1149 / / rw,relatime - overlay overlay rw,seclabel,lowerdir=/var/lib/containers/storage/overlay/l/YB7SXNMVYDGVCFJKXYRQRSJAGB,upperdir=/var/lib/containers/storage/overlay/224456aa10aeb177e6bb805d7252d7b5286a607afeeae6ea770c9ee709103ea1/diff,workdir=/var/lib/containers/storage/overlay/224456aa10aeb177e6bb805d7252d7b5286a607afeeae6ea770c9ee709103ea1/work",
          "status": "PASS"
        },
        {
          "check": "bind_readback",
          "observed": "ready",
          "status": "PASS"
        },
        {
          "check": "expected_exit",
          "observed": "7",
          "status": "PASS"
        },
        {
          "check": "remaining_containers",
          "observed": "none",
          "status": "PASS"
        }
      ],
      "selected_node": "selected_node:6a2c50906795",
      "service_account": "system:serviceaccount:ci-skills-run-948f7c274cbe4a25bea9:default",
      "verified": true
    }
  ],
  "run_id": "a418c7dbb24141e09a7f26d920b96af5",
  "schema_version": "1.0",
  "selected_node": "selected_node:6a2c50906795",
  "skill": {
    "algorithm": "sha256-tree-v1",
    "consuming_project": {
      "commit": null,
      "source": null
    },
    "digest": "db811e2af1e4ec717956f409933a773429e2f813fb16baf9f8456fe4d54cdb11",
    "file_count": 212,
    "functional_digest": "e5a3d6b3cae147228cddb0fa0b1978c94f3c4cd776ca57113589acd7ef769720",
    "revision": {
      "source": "installer_record",
      "value": "3570e1b7618e34a7d365002735c0df2fcb70667b",
      "verified": true
    }
  },
  "status": "PASS",
  "summary": {
    "error_count": 0,
    "record_count": 5
  },
  "target": "target:7bd724cadedd",
  "target_file": "path:836cb58faf1c",
  "target_source": "project",
  "tested_revision": "3570e1b7618e34a7d365002735c0df2fcb70667b"
}
