{
  "access": {
    "kubernetes": {
      "context": "default/api-ww-cai-cisco-live-dcloud-local:6443/kube:admin",
      "identity": "kube:admin",
      "server": "https://api.ww-cai-cisco-live.dcloud.local:6443"
    }
  },
  "captured_at": "2026-10-19T05:09:49.344552+00:00",
  "cleanup": {
    "failures": [],
    "resources": [
      {
        "absent": true,
        "kind": "Job",
        "name": "ci-skills-run-podman-probe-920e3c1e35343fa8",
        "namespace": "ci-skills-run-13ce60fb1d4546389065",
        "status": "PASS"
      },
      {
        "absent": true,
        "kind": "ConfigMap",
        "name": "ci-skills-run-podman-scripts-920e3c1e35343fa8",
        "namespace": "ci-skills-run-13ce60fb1d4546389065",
        "status": "PASS"
      },
      {
        "absent": true,
        "kind": "RoleBinding",
        "name": "ci-skills-run-scc-permission-5f4add9322d9458c-920e3c1e35343fa8",
        "namespace": "ci-skills-run-13ce60fb1d4546389065",
        "status": "PASS"
      },
      {
        "absent": true,
        "kind": "Namespace",
        "name": "ci-skills-run-13ce60fb1d4546389065",
        "namespace": "",
        "status": "PASS"
      }
    ],
    "status": "PASS"
  },
  "confirmable": true,
  "errors": [],
  "filters": {},
  "kind": "image_build_readiness",
  "namespace": "ci-skills-run-13ce60fb1d4546389065",
  "operation": "probe",
  "plan": {
    "authorization": {
      "behavior": "reuse_existing_or_create_temporary_role_binding",
      "cluster_role": "system:openshift:scc:privileged",
      "constraint": "privileged",
      "provider": "openshift_scc_access",
      "service_account": "default"
    },
    "claim": "nested_podman_runtime_readiness",
    "inner_image": "docker.io/library/busybox@sha256:bdf57e528e45e4433820e045b29b4597825a1c9e38353532d90a01445013f82e",
    "kind": "image_build_readiness",
    "operation": "probe",
    "probe_image": "quay.io/podman/stable@sha256:5118bdbb154b115d77f58107a2e69d65df4375bcb0d89a8da10b055754e8b9f3",
    "resources": {
      "cpu_limit": "1",
      "cpu_request": "250m",
      "memory_limit": "1Gi",
      "memory_request": "256Mi",
      "storage_size": "8Gi"
    },
    "run_scope": {
      "namespace": null,
      "namespace_mode": "generated",
      "service_account": "default"
    },
    "script_digest": "56910939591e750f910e8a8313a569125e72e9dca439b35bd76af03913f71110",
    "selected_node": "node-1.ww-cai-cisco-live.dcloud.local",
    "side_effects_on_apply": [
      "temporary_namespace",
      "temporary_scc_role_binding_when_required",
      "temporary_configmap",
      "temporary_job"
    ],
    "target": {
      "context": "default/api-ww-cai-cisco-live-dcloud-local:6443/kube:admin",
      "server": "https://api.ww-cai-cisco-live.dcloud.local:6443"
    },
    "timeout_seconds": 300
  },
  "plan_digest": "1df59ce9212a91d8a8a85a3e6f3fff5db4430bde4c35d3826703642acad3cd30",
  "probe_artifacts": {
    "log": "image_build_readiness-0e9af80599274c04818b81da15948462.probe.log",
    "markers": "image_build_readiness-0e9af80599274c04818b81da15948462.markers.json"
  },
  "records": [
    {
      "action": "VERIFIED",
      "callback": "SelectReadyWorker",
      "node": {
        "kernelVersion": "5.14.0-570.98.1.el9_6.x86_64",
        "name": "node-1.ww-cai-cisco-live.dcloud.local",
        "osImage": "Red Hat Enterprise Linux CoreOS 9.6.20260309-0 (Plow)"
      },
      "selected_node": "node-1.ww-cai-cisco-live.dcloud.local",
      "selection": "requested",
      "verified": true
    },
    {
      "action": "VERIFIED",
      "callback": "ConfirmPodmanProbe",
      "plan_digest": "1df59ce9212a91d8a8a85a3e6f3fff5db4430bde4c35d3826703642acad3cd30",
      "selected_node": "node-1.ww-cai-cisco-live.dcloud.local",
      "verified": true
    },
    {
      "action": "APPLIED",
      "callback": "OpenProbeNamespace",
      "namespace": "ci-skills-run-13ce60fb1d4546389065",
      "owns_namespace": true,
      "reused": false,
      "run_id": "0e9af80599274c04818b81da15948462",
      "verified": true
    },
    {
      "action": "APPLIED",
      "callback": "EnsureSCCAccess",
      "cluster_role": "system:openshift:scc:privileged",
      "constraint": "privileged",
      "outcome": "scc_access_ready",
      "permission_source": "temporary_role_binding",
      "role_binding": {
        "action": "APPLIED",
        "kind": "RoleBinding",
        "name": "ci-skills-run-scc-permission-5f4add9322d9458c-920e3c1e35343fa8",
        "namespace": "ci-skills-run-13ce60fb1d4546389065",
        "uid": "2c14a5f2-9030-4f4d-9245-2f51aa96a966"
      },
      "service_account": "system:serviceaccount:ci-skills-run-13ce60fb1d4546389065:default",
      "verified": true
    },
    {
      "action": "APPLIED",
      "callback": "RunPodmanProbe",
      "claim": "nested_podman_runtime_readiness",
      "job": {
        "name": "ci-skills-run-podman-probe-920e3c1e35343fa8",
        "uid": "921d225a-fa3e-4e0c-9e18-efa17173e347"
      },
      "namespace": "ci-skills-run-13ce60fb1d4546389065",
      "nested_runtime_ready": true,
      "node": {
        "kernelVersion": "5.14.0-570.98.1.el9_6.x86_64",
        "name": "node-1.ww-cai-cisco-live.dcloud.local",
        "osImage": "Red Hat Enterprise Linux CoreOS 9.6.20260309-0 (Plow)"
      },
      "outcome": "ready",
      "owns_namespace": true,
      "pod": {
        "exit_code": 0,
        "image_id": "quay.io/podman/stable@sha256:5118bdbb154b115d77f58107a2e69d65df4375bcb0d89a8da10b055754e8b9f3",
        "name": "ci-skills-run-podman-probe-920e3c1e35343fa8-98nwg",
        "uid": "61dce008-7dbb-4c53-a336-05d8c5bbb832"
      },
      "rows": [
        {
          "check": "kernel",
          "observed": "Linux 5.14.0-570.98.1.el9_6.x86_64",
          "status": "PASS"
        },
        {
          "check": "podman_version",
          "observed": "podman version 5.8.7",
          "status": "PASS"
        },
        {
          "check": "storage",
          "observed": "driver=overlay;mount_program=none;cgroup_manager=cgroupfs;graph_root=/var/lib/containers/storage;cgroup_version=v2",
          "status": "PASS"
        },
        {
          "check": "backing_filesystem",
          "observed": "xfs",
          "status": "PASS"
        },
        {
          "check": "inner_runtime",
          "observed": "id=e70e9bf27570a482767ffbbf51c20e5f26c0ff27dd1ed8767851f5969838cea9;marker=inner-ok;cgroup=0::/kubepods.slice/kubepods-burstable.slice/kubepods-burstable-pod61dce008_7dbb_4c53_a336_05d8c5bbb832.slice/crio-b11ebc8434d482842fa24e0b97b4b7f9a3732baa07c5b4e9d3de6e5e61ef9398.scope,;root=21354 20065 0:1197 / / rw,relatime - overlay overlay rw,seclabel,lowerdir=/var/lib/containers/storage/overlay/l/DIYPKUOAFATP76NAUY6SDEU5EC,upperdir=/var/lib/containers/storage/overlay/8b05cd9f9b95796994abbd62a98456585a2b276b9f466a82c8abaf12acdb92b6/diff,workdir=/var/lib/containers/storage/overlay/8b05cd9f9b95796994abbd62a98456585a2b276b9f466a82c8abaf12acdb92b6/work",
          "status": "PASS"
        },
        {
          "check": "bind_readback",
          "observed": "ready",
          "status": "PASS"
        },
        {
          "check": "expected_exit",
          "observed": "7",
          "status": "PASS"
        },
        {
          "check": "remaining_containers",
          "observed": "none",
          "status": "PASS"
        }
      ],
      "selected_node": "node-1.ww-cai-cisco-live.dcloud.local",
      "service_account": "system:serviceaccount:ci-skills-run-13ce60fb1d4546389065:default",
      "verified": true
    }
  ],
  "run_id": "0e9af80599274c04818b81da15948462",
  "schema_version": "1.0",
  "selected_node": "node-1.ww-cai-cisco-live.dcloud.local",
  "skill": {
    "algorithm": "sha256-tree-v1",
    "consuming_project": {
      "commit": null,
      "source": null
    },
    "digest": "39de6f3b5f6a310222dba33ddb45ed894f8a8a1642c3f0574ecd0962881cf992",
    "file_count": 234,
    "functional_digest": "972b1e04f7c859dd97472031cb0d49c8e78228320a5488702e2c7309bc625959",
    "revision": {
      "source": "installer_record",
      "value": "92871b23992c391edbab940ae32893f754179f0b",
      "verified": true
    }
  },
  "status": "PASS",
  "summary": {
    "error_count": 0,
    "record_count": 5
  },
  "target": "default/api-ww-cai-cisco-live-dcloud-local:6443/kube:admin@https://api.ww-cai-cisco-live.dcloud.local:6443",
  "target_file": "path:5e5380df1eda",
  "target_source": "env:CI_SKILLS_TARGET",
  "tested_revision": "92871b23992c391edbab940ae32893f754179f0b"
}
